Unnamed: 0,ID,Stock,Date,User_Name,User_ID,User_Followers,User_Verified,User_Lists,Likes,Retweets,Replies,URL,Text
167,1213494838915686400,AMC,2020-01-04 16:18:09+00:00,Rajinikanth Fans,497770148,69865,0,51,241,109,8,https://twitter.com/RajiniFC/status/1213494838915686400,Massive release plan for Darbar in the USA Here is the AMC Theatre list for the Tamil and Telugu versions Ticket bookings for the remaining locations will be opened on Monday DarbarInUSA
168,1213492053839093760,AMC,2020-01-04 16:07:05+00:00,PrimeMedia,1264698811,6282,0,20,235,100,5,https://twitter.com/PrimeMediaUS/status/1213492053839093760,Darbar final list Will play both Tamil Telugu in all locs Tkts will open on Monday in locs that aren t opened yet
169,1213618744582270976,AMC,2020-01-05 00:30:31+00:00,𝐑𝐚𝐣𝐢𝐧𝐢☆𝐅𝐨𝐥𝐥𝐨𝐰𝐞𝐫𝐬,208936817,35665,0,32,204,94,3,https://twitter.com/RajiniFoLLowers/status/1213618744582270976,USA List .. Many screens added Darbar Grand USA Premieres on Jan 8th
170,1213618064908050432,AMC,2020-01-05 00:27:49+00:00,PaniPuri,908965886781923328,19975,0,15,131,61,1,https://twitter.com/THEPANIPURI/status/1213618064908050432,"Darbar USA List .. Grand USA Premieres on Jan 8th .. Bookings Opened Now , Book Your Tickets Now .. Rajini Rajinikanth Nayanthara NivethaThomas"
171,1214189251904069632,AMC,2020-01-06 14:17:30+00:00,AMC Theatres,40245758,521581,1,2297,156,61,9,https://twitter.com/AMCTheatres/status/1214189251904069632,"Here is your first look at the NewMutants Arriving in theatres at AMC April 3 , 2020"
172,1214036367090565121,AMC,2020-01-06 04:10:00+00:00,AMC Theatres,40245758,521581,1,2297,83,21,7,https://twitter.com/AMCTheatres/status/1214036367090565121,And the GoldenGlobes winner for Best Motion Picture Drama is
173,1214033025383751681,AMC,2020-01-06 03:56:43+00:00,AMC Theatres,40245758,521581,1,2297,332,57,9,https://twitter.com/AMCTheatres/status/1214033025383751681,The GoldenGlobes winner for Best Performance by an Actor in a Motion Picture Drama is JoaquinPhoenix
174,1214031317408665600,AMC,2020-01-06 03:49:56+00:00,AMC Theatres,40245758,521581,1,2297,86,15,1,https://twitter.com/AMCTheatres/status/1214031317408665600,And the GoldenGlobes winner for Best Motion Picture Musical or Comedy is
175,1214029001716621312,AMC,2020-01-06 03:40:44+00:00,AMC Theatres,40245758,521581,1,2297,129,20,1,https://twitter.com/AMCTheatres/status/1214029001716621312,Congratulations to Awkwafina the GoldenGlobes winner for Best Performance by an Actress in a Motion Picture Musical or Comedy
176,1214565697868587010,AMC,2020-01-07 15:13:22+00:00,PrimeMedia,1264698811,6282,0,20,74,41,7,https://twitter.com/PrimeMediaUS/status/1214565697868587010,"Darbar Highwoods , Tampa update their last show of the day is 8 30pm If we don t get permission for early premier shows then they won t have premier show tomm Options are Villagion Cinemas , Britton 8 Regal Citrus Park 24"
177,1214940439696027660,AMC,2020-01-08 16:02:27+00:00,AMC Theatres,40245758,521581,1,2297,49,13,2,https://twitter.com/AMCTheatres/status/1214940439696027660,Discover the truth about Brahms TheBoy 2 coming to AMC this February Set a ticket reminder now
178,1215332415159164930,AMC,2020-01-09 18:00:02+00:00,AMC Theatres,40245758,521581,1,2297,287,113,50,https://twitter.com/AMCTheatres/status/1215332415159164930,Zoom in on this BOSS prize pack Follow Like now to be entered to win See LikeABoss this weekend at AMC
179,1215315638798954498,AMC,2020-01-09 16:53:22+00:00,AMC Theatres,40245758,521581,1,2297,72,24,2,https://twitter.com/AMCTheatres/status/1215315638798954498,"Gotham s worst brings out their best Meet Harley Quinn , Black Canary , Huntress , Renee Montoya , and Cassandra Cain BirdsOfPrey arrives in theatres February 7 Ticket Reminder"
180,1215106678191865856,AMC,2020-01-09 03:03:02+00:00,AMC Theatres,40245758,521581,1,2297,50,23,1,https://twitter.com/AMCTheatres/status/1215106678191865856,"Set at the bottom of the ocean , is a this year s first adventure thriller that will have audiences on the edge of their seats Read On"
181,1216046040647946240,AMC,2020-01-11 17:15:43+00:00,leah ☽,2320567193,1007,0,3,67,17,8,https://twitter.com/leahhhtaylor/status/1216046040647946240,hey what on earth is on your seats
182,1216768098704949248,AMC,2020-01-13 17:04:55+00:00,AMC Theatres,40245758,521581,1,2297,274,71,7,https://twitter.com/AMCTheatres/status/1216768098704949248,How far are we allowed to go to fix something that s broken Here is the teaser trailer for MORBIUS Coming to AMC this summer
183,1216717250645975042,AMC,2020-01-13 13:42:52+00:00,AMC Theatres,40245758,521581,1,2297,139,31,18,https://twitter.com/AMCTheatres/status/1216717250645975042,Best Picture OscarNoms Ford v Ferrari The Irishman Jojo Rabbit Joker Little Women Marriage Story 1917 Once a Upon Time ... in Hollywood Parasite
184,1216712985953128449,AMC,2020-01-13 13:25:55+00:00,AMC Theatres,40245758,521581,1,2297,57,13,8,https://twitter.com/AMCTheatres/status/1216712985953128449,Best Supporting Actor OscarNoms Brad Pitt Once Upon a Time in Hollywood Tom Hanks A Beautiful Day in the Neighborhood Anthony Hopkins The Two Popes Al Pacino The Irishman Joe Pesci The Irishman
185,1217068727205756928,AMC,2020-01-14 12:59:31+00:00,AMC Theatres,40245758,521581,1,2297,41,15,3,https://twitter.com/AMCTheatres/status/1217068727205756928,Superheroes just got an upgrade Check out the new Bloodshot international trailer In theatres March 13 set a ticket reminder now
186,1212472975062163457,PFE,2020-01-01 20:37:38+00:00,dough,3426014292,32982,0,856,93,36,5,https://twitter.com/semodough/status/1212472975062163457,William BLAIR excellent slide on Platform GeneTherapy Companies Will Likely Drive Innovation While Gene Therapy Users Have Greater Capital number indicates of gene therapy programs each company has
187,1212382370390827011,PFE,2020-01-01 14:37:36+00:00,Blue Chip Daily Trend Report,1205452857077571586,2635,0,81,228,45,20,https://twitter.com/BlueChipDailyTR/status/1212382370390827011,"My 2020 Turnaround Ideas List Video These are not my traditional uptrend names , but potential turnaround ideas 20 charts in about 20 minutes"
188,1212348235936874496,PFE,2020-01-01 12:21:58+00:00,Gualestrit,857693619406467072,50532,0,705,121,48,2,https://twitter.com/gualestrit/status/1212348235936874496,Dow Jones 2019 Apple 84 Microsoft 55 JPMorgan 43 Visa 42 United Technologies 41 ... Exxon Mobil 2 Boeing 1 3M 7 Pfizer 10 Walgreens 14
